{
  "$schema": "https://json-schema.org/draft/2020-12/schema",
  "$id": "https://rootstock.dev/contracts/cve-scan-export/v7/schema.json",
  "title": "cve-scan Rootstock Export v7",
  "description": "Versioned cve-scan graph import artifact; not a collector scan result.",
  "type": "object",
  "additionalProperties": false,
  "required": [
    "schema_version",
    "generated_at",
    "scope_name",
    "scan_profile",
    "effective_limits",
    "node_count",
    "edge_count",
    "node_types",
    "edge_types",
    "edge_vocabulary",
    "nodes",
    "edges"
  ],
  "properties": {
    "schema_version": { "const": 7 },
    "generated_at": { "type": "string", "format": "date-time" },
    "scope_name": { "$ref": "#/$defs/nonEmptyString" },
    "scan_profile": { "$ref": "#/$defs/nonEmptyString" },
    "effective_limits": {
      "type": "object",
      "additionalProperties": { "type": "integer", "minimum": 0 }
    },
    "node_count": { "type": "integer", "minimum": 0 },
    "edge_count": { "type": "integer", "minimum": 0 },
    "node_types": {
      "type": "array",
      "uniqueItems": true,
      "items": { "$ref": "#/$defs/nodeType" }
    },
    "edge_types": {
      "type": "array",
      "uniqueItems": true,
      "items": { "$ref": "#/$defs/edgeType" }
    },
    "edge_vocabulary": {
      "const": [
        "AFFECTS", "CONTAINS_MANIFEST", "DECLARES_PACKAGE", "DEPENDS_ON",
        "EXPOSES", "HAS_CERT", "HAS_COVERAGE_GAP", "HAS_CONTEXT",
        "HAS_DATA_CONTEXT", "HAS_FINDING", "HAS_IDENTITY_CONTEXT",
        "HAS_REMEDIATION", "HOSTS", "MATCHED_BY", "OWNED_BY", "RUN", "SERVES"
      ]
    },
    "nodes": {
      "type": "array",
      "items": { "$ref": "#/$defs/node" }
    },
    "edges": {
      "type": "array",
      "items": { "$ref": "#/$defs/edge" }
    }
  },
  "$defs": {
    "nonEmptyString": { "type": "string", "minLength": 1 },
    "nodeType": {
      "enum": [
        "Asset", "AssetContext", "Certificate", "CoverageGap", "DataContext",
        "Finding", "Host", "IdentityContext", "Manifest", "Owner", "Package",
        "Remediation", "Repository", "Service", "Vulnerability", "WebApp"
      ]
    },
    "edgeType": {
      "enum": [
        "AFFECTS", "CONTAINS_MANIFEST", "DECLARES_PACKAGE", "DEPENDS_ON",
        "EXPOSES", "HAS_CERT", "HAS_COVERAGE_GAP", "HAS_CONTEXT",
        "HAS_DATA_CONTEXT", "HAS_FINDING", "HAS_IDENTITY_CONTEXT",
        "HAS_REMEDIATION", "HOSTS", "MATCHED_BY", "OWNED_BY", "RUN", "SERVES"
      ]
    },
    "node": {
      "type": "object",
      "required": ["id", "type", "name"],
      "properties": {
        "id": { "$ref": "#/$defs/nonEmptyString" },
        "type": { "$ref": "#/$defs/nodeType" },
        "name": { "$ref": "#/$defs/nonEmptyString" }
      },
      "additionalProperties": { "$ref": "#/$defs/jsonValue" }
    },
    "edge": {
      "type": "object",
      "additionalProperties": false,
      "required": ["from", "to", "type"],
      "properties": {
        "from": { "$ref": "#/$defs/nonEmptyString" },
        "to": { "$ref": "#/$defs/nonEmptyString" },
        "type": { "$ref": "#/$defs/edgeType" }
      }
    },
    "jsonValue": {
      "anyOf": [
        { "type": "string" },
        { "type": "number" },
        { "type": "boolean" },
        { "type": "null" },
        { "type": "array", "items": { "$ref": "#/$defs/jsonValue" } },
        { "type": "object", "additionalProperties": { "$ref": "#/$defs/jsonValue" } }
      ]
    }
  }
}
