{
  "schema_version": 7,
  "generated_at": "2026-05-03T00:00:00+00:00",
  "scope_name": "rootstock-cve-scan-demo",
  "scan_profile": "standard",
  "effective_limits": {
    "request_budget": 20,
    "max_manifest_depth": 2
  },
  "node_count": 11,
  "edge_count": 13,
  "node_types": [
    "Certificate",
    "CoverageGap",
    "Finding",
    "Host",
    "Manifest",
    "Package",
    "Remediation",
    "Repository",
    "Service",
    "Vulnerability",
    "WebApp"
  ],
  "edge_types": [
    "AFFECTS",
    "CONTAINS_MANIFEST",
    "DECLARES_PACKAGE",
    "EXPOSES",
    "HAS_CERT",
    "HAS_COVERAGE_GAP",
    "HAS_FINDING",
    "HAS_REMEDIATION",
    "HOSTS",
    "MATCHED_BY",
    "SERVES"
  ],
  "edge_vocabulary": [
    "AFFECTS",
    "CONTAINS_MANIFEST",
    "DECLARES_PACKAGE",
    "DEPENDS_ON",
    "EXPOSES",
    "HAS_CERT",
    "HAS_COVERAGE_GAP",
    "HAS_CONTEXT",
    "HAS_DATA_CONTEXT",
    "HAS_FINDING",
    "HAS_IDENTITY_CONTEXT",
    "HAS_REMEDIATION",
    "HOSTS",
    "MATCHED_BY",
    "OWNED_BY",
    "RUN",
    "SERVES"
  ],
  "nodes": [
    {
      "id": "Certificate:app.example.test_443_app.example.test",
      "type": "Certificate",
      "name": "app.example.test",
      "issuer": "Example Test CA",
      "expires_at": "2027-05-03T00:00:00+00:00",
      "trusted": true,
      "tls_version": "TLSv1.3",
      "cipher": "TLS_AES_256_GCM_SHA384"
    },
    {
      "id": "CoverageGap:web-header-gap",
      "type": "CoverageGap",
      "name": "https://app.example.test/",
      "source": "https://app.example.test/",
      "coverage_status": "partial",
      "reason": "passive web probe did not authenticate",
      "evidence": "login-required",
      "target_class": "web_url"
    },
    {
      "id": "Finding:fastapi-demo-cve",
      "type": "Finding",
      "name": "FastAPI demo package is affected by CVE-2026-9701",
      "severity": "HIGH",
      "confidence": "HIGH",
      "rule_id": "package.vulnerable",
      "target_class": "repository",
      "triage_score": 86,
      "triage_level": "urgent",
      "usage_signal": "declared"
    },
    {
      "id": "Host:app.example.test",
      "type": "Host",
      "name": "app.example.test",
      "asset_environment": "demo",
      "asset_criticality": "medium",
      "asset_exposure": "internal"
    },
    {
      "id": "Manifest:repo_requirements.txt",
      "type": "Manifest",
      "name": "repo/requirements.txt",
      "path": "repo/requirements.txt",
      "source_type": "requirements"
    },
    {
      "id": "Package:pypi_fastapi_0.115.0_repo_requirements.txt",
      "type": "Package",
      "name": "fastapi",
      "version": "0.115.0",
      "ecosystem": "pypi",
      "source": "repo/requirements.txt",
      "purl": "pkg:pypi/fastapi@0.115.0",
      "target_class": "repository",
      "usage_signal": "declared"
    },
    {
      "id": "Remediation:update-fastapi",
      "type": "Remediation",
      "name": "Upgrade FastAPI",
      "title": "Upgrade FastAPI",
      "target": "repo/requirements.txt",
      "target_class": "repository",
      "best_next_action": "Upgrade fastapi to 0.115.1 or newer",
      "confidence": "HIGH",
      "fixed_version": "0.115.1"
    },
    {
      "id": "Repository:repo",
      "type": "Repository",
      "name": "repo"
    },
    {
      "id": "Service:app.example.test_443_https",
      "type": "Service",
      "name": "https:443",
      "port": 443,
      "protocol": "https",
      "product": "example-api",
      "version": "1.0.0",
      "target_class": "network_service",
      "usage_signal": "exposed"
    },
    {
      "id": "Vulnerability:CVE-2026-9701",
      "type": "Vulnerability",
      "name": "CVE-2026-9701",
      "kev": false,
      "epss": 0.12,
      "solution": "Upgrade to FastAPI 0.115.1",
      "triage_score": 86,
      "triage_level": "urgent"
    },
    {
      "id": "WebApp:https___app.example.test_",
      "type": "WebApp",
      "name": "https://app.example.test/",
      "url": "https://app.example.test/",
      "target_class": "web_url",
      "usage_signal": "exposed"
    }
  ],
  "edges": [
    {
      "from": "Host:app.example.test",
      "to": "Service:app.example.test_443_https",
      "type": "EXPOSES"
    },
    {
      "from": "Service:app.example.test_443_https",
      "to": "WebApp:https___app.example.test_",
      "type": "HOSTS"
    },
    {
      "from": "Host:app.example.test",
      "to": "WebApp:https___app.example.test_",
      "type": "SERVES"
    },
    {
      "from": "Service:app.example.test_443_https",
      "to": "Certificate:app.example.test_443_app.example.test",
      "type": "HAS_CERT"
    },
    {
      "from": "Repository:repo",
      "to": "Manifest:repo_requirements.txt",
      "type": "CONTAINS_MANIFEST"
    },
    {
      "from": "Manifest:repo_requirements.txt",
      "to": "Package:pypi_fastapi_0.115.0_repo_requirements.txt",
      "type": "DECLARES_PACKAGE"
    },
    {
      "from": "Package:pypi_fastapi_0.115.0_repo_requirements.txt",
      "to": "Vulnerability:CVE-2026-9701",
      "type": "MATCHED_BY"
    },
    {
      "from": "Vulnerability:CVE-2026-9701",
      "to": "Package:pypi_fastapi_0.115.0_repo_requirements.txt",
      "type": "AFFECTS"
    },
    {
      "from": "Vulnerability:CVE-2026-9701",
      "to": "Service:app.example.test_443_https",
      "type": "AFFECTS"
    },
    {
      "from": "Package:pypi_fastapi_0.115.0_repo_requirements.txt",
      "to": "Finding:fastapi-demo-cve",
      "type": "HAS_FINDING"
    },
    {
      "from": "Vulnerability:CVE-2026-9701",
      "to": "Finding:fastapi-demo-cve",
      "type": "HAS_FINDING"
    },
    {
      "from": "Finding:fastapi-demo-cve",
      "to": "Remediation:update-fastapi",
      "type": "HAS_REMEDIATION"
    },
    {
      "from": "WebApp:https___app.example.test_",
      "to": "CoverageGap:web-header-gap",
      "type": "HAS_COVERAGE_GAP"
    }
  ]
}
