{
  "schema_version": 7,
  "generated_at": "2026-08-27T00:00:00Z",
  "scope_name": "contract-fixture",
  "scan_profile": "standard",
  "effective_limits": {},
  "node_count": 1,
  "edge_count": 0,
  "node_types": ["Host"],
  "edge_types": [],
  "edge_vocabulary": [
    "AFFECTS", "CONTAINS_MANIFEST", "DECLARES_PACKAGE", "DEPENDS_ON",
    "EXPOSES", "HAS_CERT", "HAS_COVERAGE_GAP", "HAS_CONTEXT",
    "HAS_DATA_CONTEXT", "HAS_FINDING", "HAS_IDENTITY_CONTEXT",
    "HAS_REMEDIATION", "HOSTS", "MATCHED_BY", "OWNED_BY", "RUN", "SERVES"
  ],
  "nodes": [
    { "id": "Host:fixture", "type": "Host", "name": "fixture" }
  ],
  "edges": []
}
